{"captured_at":"2026-09-24T00:00:00Z","clock":"SOURCE_MONOTONIC_NOT_PORTABLE","model":{"claims":{"closed_admission":"UNKNOWN","controller_continuity":"UNKNOWN","domain_empty":"UNKNOWN","epoch_current":"UNKNOWN","filesystem_exclusive":"UNKNOWN","launch_identity":"UNKNOWN"},"expires_ns":"1","generation":"example-1","observed_ns":"0","project":"synthetic-demo","provenance":"SYNTHETIC"},"mutation_authorized":false,"omissions":["SOURCE_CONTENT","GIT_OBJECTS","V3_RECEIPTS","LIVE_AUTHORITY","FILESYSTEM_PROOF"],"production_p3":"UNKNOWN","profile":"QUIESCENCE_MODEL_ONLY","safe_to_resume":"UNKNOWN","snapshot_id":"example-1","source_instance":"synthetic-example","version":"cgcchild-state-0.1-experimental"}
